id,title,description,duration_string,search_keyword
rP62FBkVdJ0,Homemade autonomous Quadcopter with GPS!! #drone #diy #homemade #rcdrone #gpsdrone #stability #rc,,23,first person view DIY
UXnVyiz8fpo,DIY DRONE GATES - Day 11 of learning to fly a #tinywhoop #fpv,,1:00,first person view DIY
dxvDfHzQhio,DIY RC Boat: Mini Hydro doing laps at 77km/h,,21,first person view DIY
L84YRPg9fgg,DIY Variable Pitch Kamikaze Drone #computervision #diydrone #fpvdrones #solodeveloper #opensourceai,,29,first person view DIY
6Gu2yb5aIgc,Skydroid G20 connecting to Skydroid S2 debugging on the remote controller #diy #drone #wiring,,44,first person view DIY
qJ0YItGZjtA,RC plane with Tx Diy and balance board #arduino #uav #rc #plane #drone #fpv #nxp #stm #car #diy,,39,first person view DIY
uGSPsqO6PD8,Wind Resistance DIY Drone #drone #windresistance #baohq #ownflightcontroller,,1:01,first person view DIY
PVC-hHn_4VI,🚀 My DIY F450 Drone Build | Pixhawk + GPS Flight Test | Smooth Takeoff & Hover! 🔧,,35,first person view DIY
M1ft84f7BKs,#drone #fpv #fpvdrone #photographer #diy #tws #trending #shortsvideo #vairalvideo @ankit bhai,,34,first person view DIY
3mTaxpUWFDc,A #flying #fpv  look at my friends #greenhouse build #drone #diy,,28,first person view DIY
S8Z3ycNPfcw,Drone diy use STM32 + Arduino #drone #arduino #pid #diy #fpv #stm #quadcopter #robot #motor #rc #uav,,53,first person view DIY
FQeoybjOTfo,FPV Drone Warhead DIY Bomber Replica #FPVDrone,,59,first person view DIY
cYrXnhyrnLA,Assembling the Pavo20 #fpvdrone #dji #flying #diy #djio3,,52,first person view DIY
m7njnJfxv3U,#dji #avata2 case DIY / #fpv #fpvdrone @DJI,,38,first person view DIY
ZKBzBtR3vSs,DIY FPV Drone #fpv #drone #fpvdrone #diy,,36,first person view DIY
747BXLEhY4w,First test flight | Need more tuning for yaw #drone #diy #diycrafts,,48,first person view DIY
QQLy-y5JO3I,DIY Simple Gimbal for FPV Drone | Elevate Your Flying Experience!,,20,first person view DIY
Je8S2nVCic0,raspberry pi pico drone | make in india | Raspberry pi drone | Tricopter | DIY Drone 🇮🇳🛩✈🚀🚁 #shorts,,1:00,first person view DIY
6_C-k14zm3s,China Develops DRONE Smaller Than a Mosquito! #fpv #drone #build #diy #remote #flyrobo #newsong,,34,first person view DIY
s1fxZ-VWs2U,"How to Build a PC, the last guide you’ll ever need! (2024 Update)",,1:54:49,first person view DIY
NALrMdEepmg,Land Rover Freelander 2 Diesel Fuel Filter Replacement DIY First Person View !,,17:26,first person view DIY
EWQ6wlSJa1E,F117 diy test #f117 #diy #rc #rcplane,,30,first person view DIY
XQP5oyqzlLw,Smoothest test flight #3dprinting #drone #3dprinteddrone  #fpv#diy,,30,first person view DIY
_YTV4BbOfuM,New jet 🥳 #diy #flitetest #rcplane #fpv #scratchbuilding #kidsvideo #building #rc #crossgenrc,,11,first person view DIY
zmK78LrWL5Q,First person view - basic pcp air shooter #shorts #diypvc #diy #pvcpipe,,29,first person view DIY
WmMgTV_Jc9I,DIY Drone Bombs 200 Rubber Ducks 🦆💥 (Duck Bombing FAIL) #shorts #3dprinting #diy #fpv #lake,,33,first person view DIY
bvRzDEURBIk,#diy #rcplane #rchobby #fixedwing #fpv #nature #naturelovers #shorts #trending #trendingshorts,,36,first person view DIY
iw6D3Y66zyI,ESP32-CAM FPV Drone Test – Range & Delay Explained #diy #drone #fpv #beltfpv #fpvdrone #engineering,,1:16,first person view DIY
7uSVf1mY7ZY,I did Everything 😂,,21,first person view DIY
sOV_YSrPQyc,First person RC drifting 🚘 #rc #fpv #3dprinting #diy #fusion360 #drift,,26,first person view DIY
iHHID6Y-2Zo,"Transformer Drives as Tank, next step is go to fly #fpv #diy first step is done",,54,first person view DIY
7a3H43fCcBY,Diy Amazing mini drone | Gone wrong😢 #jlcpcb,,59,first person view DIY
x-mGavKACrU,Diy DJI Cinelifter 😁😂 #cinelifter #diy #drone #freestyle #fpv #dji,,38,first person view DIY
T02PaPGz9m8,"RC plane crash Flies into dirt, DIY Foam CrashMaster  #aviation #diyrc #rcplane #drone #rcdiy #foam",,48,first person view DIY
5ubXLe05ZMY,Our DIY Generator Power Problems On Our Off Grid Boat Restoration Project ,,21:57,first person view DIY
uOP1yI3Xmhg,Seperate Thermal module for Any Drone. Easy DIY,,51,first person view DIY
V3hEjKaqydg,Corvo Flight Video #corvo #fpv #rc #rcplane #ukraine #cardboard #diy #fpvdrone,,58,first person view DIY
YI9Ma4qhtTo,FPV Chaser Drone LOS flying #drone #fpv #diy #rc #fpvdrone #quadmovr #chasing,,50,first person view DIY
H9t41zSb1GM,My First #FPV DIY Repair #FPVDrone #SolderingFails #DroneRepair #repair #dronecrash #fpvrepair,,23,first person view DIY
fysMfxdLaTg,Quadcopter diy #drone #uav #arduino #stm #pid #diy #fpv #robot #sensor #plane #quadcopter #rc,,48,first person view DIY
uozG7sk2Gcw,acro drone #drone #fpv #diy #fpvdrone #rc #quadmovr,,23,first person view DIY
poYrpzOrQuA,Diy 4x4 FPV RC Car | How to Make FPV Car 😎 #jlcpcb,,58,first person view DIY
oetXtJZppWk,Finishing My FPV Racing Drone | #drone #fpv #diy #trending,,42,first person view DIY
Iu9rAUh-GdY,First flight of diy drone.      #drone #diy #dronevideo #highvoltage19 #highvoltage,,34,first person view DIY
fcuXaqaT-Vw,#DIY #hexacopter/ How to pratice flying a drone. #shorts,,1:00,first person view DIY
cObY2VmrgBI,Homemade DIY Mobile Camera Drone flight test #drone #dronevideo,,58,first person view DIY
uiNRLz7sFzk,"3D printed 3.5"" drone. Can it fly? #drone #diy #fpv #3dprinting",,54,first person view DIY
MApeef1fEWs,Tiny Whoop Mini Track! #diy #diycrafts #project #music #drone #fpv #fpvdrone #youtubeshorts #dji,,16,first person view DIY
5nyQczl7_lE,Changing motors and FC ⚡️ #fpv  #capcut #diy #hobby #xing #apex #impulserc #getfpv,,55,first person view DIY
c3oh8WA9Y88,FPV Noching Coconut Tree #woodworking #jungle #diy #satisfying#wood #fpv #trending #philippines #god,,25,first person view DIY
dK6-w_CxKE8,Mind-blowing facts about freestyle fpv drone the ultimate DIY project #fpv #fpvdrone #facts #diy,,57,first person view DIY
dO_b0NnvMAc,Diy Rc plane | goods carrier | soft landing #diy #rcplane #fpv #fixedwing,,17,first person view DIY
WFuqwNOTIvk,ESP32 WIFI DRONE Flight Video #esp32 #airplane #arduino #drone #diy #wifi #fpv #coding,,1:01,first person view DIY
7qzIJa4unF0,New plane alert 🚨  #diy  #aviation  #rc #scratchbuilding,,40,first person view DIY
zMecshBZxKA,Homemade Foam Drone First Flight Test 😱 #shorts #shortsfeed #drone #diy,,51,first person view DIY
DRp_MZqLYjE,homemade drone flying test..#shortvideo #dronemaking #fpv #samarexperiment #quadcopter #diy #drone,,1:01,first person view DIY
ac5K874yOmE,DIY Mini FPV Drone awesome build,,22,first person view DIY
x74mnJkaKYk,DIY Arduino RC Car with Flysky Remote & FPV Camera | Off-Road Ride #shorts #mn99s #diy #arduino,,39,first person view DIY
EbJm8V-Izuc,chaser drone signature move #drone #fpv #diy #fpvdrone #rc #quadmovr,,4,first person view DIY
HFCLXf3mNj4,FPV Clay War RC Battle Destruction Part:2 #airsoft #DIY #combat #battle #scopecam #slomo #claymation,,59,first person view DIY
Op_iYpRIYVc,First Indian made Fpv Stack #fpv #fpvdrone #diy #lipobattery,,56,first person view DIY
C6CzO_45o6Q,TAKEOFF at HVK #diy #aviation #automobile #fpv #travel #wood #handmade #timelapse,,25,first person view DIY
_k0XNOycje0,Diwali Wali Gun 💀😱 | Mini Vlog #shorts #minivlog #ashortaday #vlog #tranding #cats #cat,,49,first person view DIY
EgdlxP-GTN8,RC plane build flight F-22 etc #build #aviation #drone #diy #rcjet #speed #f22 #su57 #hobbyking #rc,,1:42,first person view DIY
tmyuaoLaHeE,FPV camera setup in Telugu#telugu #telugutech #diy #rccar #shorts #dcmotor,,1:33,first person view DIY
vQn5iSewNiU,Esp32 DIY drone PCB flight test #drone #cheapdrone #esp32 #esp32project #uav,,48,first person view DIY
5neEaV4-hx4,UAVTECH PRESETS FPV DIY 9INCH DRONE#FPV QUADCOPTER,,3:01,first person view DIY
GP3n6R241io,DJI NAZA M Lite indoor fly without GPS! #dji #drone #quadcopter #diy #rchobby #fpvdrone #flysky #rf,,1:01,first person view DIY
zoANXwvABNw,Back in the air after a long break. #shorts #gopro #fpv #diy #drone #flying #dji,,58,first person view DIY
wjLwHoEPAD8,"Stark 5"" Freestyle Airframe. #drone #fpv #diy",,28,first person view DIY
xItY0HuxRfM,#fpv #diy #conelsellodelacasa #nosabiaquelonecesitaba #typebeat #beats #trap #home,,16,first person view DIY
AFHX69ACqUQ,Drone L600pro #dji #helicopter #dronefly #diy #djimini #robot #drone #toy #djidrone,,1:00,first person view DIY
QaMdp6PRP2A,Speedybee Mario DC Advance with DJI o3 #dji #diy#fpvfreestyle#drone#bnf#fpvdrone #music #anime #phon,,37,first person view DIY
5CLy4k9r_gw,FPV RACING DRONE #youtubeshorts #drone #fpv #dji #djidrone #diy #trending #viral #fypシ #fypシ゚viral,,33,first person view DIY
TWcuPl1oIz0,DIY Drone Flip kaise hota hai | Drone Flip Mode | Drone Flying✈️ Video🎥 #shorts,,1:00,first person view DIY
T_CKQ5Sfv0U,FPV drone in the sky.      #drone #fpvdrone #shorts #short #geprc #diy,,37,first person view DIY
ajxGX44cDl8,DIY TAROT Drone part-4 #fpv #youtubeshorts #drone #diy #dji #fpvdrone #trending #viral #dronelife,,41,first person view DIY
h8OoY_ZwWXc,C17 - Global Master wingspan 1500mm #airplane #fpv #rcplane #diy #drone,,16,first person view DIY
26TcGtml8v4,FPV at ARC #drone #diy#fpv #fpvfreestyle #shorts,,25,first person view DIY
SPHqgckHcEU,"sky high hand launch. 90""vatil #diy #shorts #rcairplanes",,26,first person view DIY
_hU1CnRNA14,VTX-F1 FPV Video Trasmitter (VTX). #drone #drones#fpv #fpvfreestyle  #electronics #diy,,2:13,first person view DIY
KosQDiH0xhw,FPV drone to sky is the limit ... |#shorts #drone #diy #short #dronevideo#fpvdrone #fpv,,16,first person view DIY
0Hw2T5nVAAk,"first flight of my 90"" v tail. #shorts #fpv #diy",,3:01,first person view DIY
-4ukV-RtnXQ,Best fpv beginner Drone || #ytshorts #viralvideo #shortvideo #shorts #airplane #diy #drone,,31,first person view DIY
yaeybWeE2go,RC PLANE CANARD #shorts #canard #rcplane  #remotecontrol #fpvdji #hobby #diy,,53,first person view DIY
DZDA1RyyfkQ,Drone shots video camera shots drone camera#drone #freefire #dji #diy,,31,first person view DIY
QAckbVR3fb4,DIY DRONE FLYING IN THE MOUNTAIN,,44,first person view DIY
jvurgX6b43s,How to long butterfly haircut #shorts,,17,first person view DIY
1wslWIvAJeQ,64 mm edf jet #rafale #diy #edfjet #rc  #runcam5  #fpv  @wingsmh27,,54,first person view DIY
KC4FgfE4GrU,Thermal Drone #diy #adventure #fyp,,22,first person view DIY
7N-dT6Pvje8,Building 5inch FPV drone with DJI o4 pro,,35:11,first person view DIY
FyDyK7sxdj4,the fpv flying rc plane #diy #rcflying #quadcopter,,23,first person view DIY
gU2UQMExN_o,fpv freestyle drone build  |#shorts #short #diy #drone #fpv #fpvdrone #india #hobby #racing,,30,first person view DIY
H1OvLfvHknc,Spray Time 😎 With My Diy Quad😜 #shortvideo #trending #drone #top #shortfeeds #shorts #reels #diy #rc,,18,first person view DIY
rmQYk5EJPGs,DIY Drone Octocopter #fpv #dronetutorial #drone,,1:09,first person view DIY
nUR2XasMXgs,#diy #fpv #drone #speedybee #freestyle,,32,first person view DIY
2c9q-8YYqO4,90mins Flight Time Mapping Drone. Made in India. #drone #quadcopter #diy,,31,first person view DIY
j7qEwqD5P0Q,Quadcopter Arduino #drone #quadcopter #arduino #fpv #uav #diy #flysky #pid #motor #rc #stm,,1:07,first person view DIY
OKBDjvtryGE,Quanum DIY FPV Goggle V2 Build and Review - RCTESTFLIGHT -,,18:24,first person view DIY
wR_av08Vqdw,🚁 Testing My DIY FPV Drone for the First Time #shorts,,25,first person view DIY
fidRarBUl8Y,My Drones Collections at the moment | #drone #fpv #diy,,14,first person view DIY
ePdzBKkqsxk,Ripping the slash 4x4. #hobby #diy #rc #4x4,,8,first person view DIY
p39jlci5uOc,Built A Drone!🚁🫡 #ai #asmr #youtube #shorts #drone,,25,first person view DIY
9iT8g3iJGKY,DIY F450 Drone Takeoff & Hover Test | Pixhawk GPS Stable Flight 2025 🔥| ASMR,,1:01,first person view DIY
KvCklvbPqQg,diy strobe light for rc plane #diy #rcplane #fixedwing #fpvplane #fpv,,15,first person view DIY
WWB244g6jBg,DIY RC Plane #shortvideo #airplane #fpv,,59,first person view DIY
hxQUqjbfAmc,Assembled & Delivered camera drone ,,11,first person view DIY
QgPF2egdn-M,First 3D print for Tiny Drone #fpv #drone #fpvdrone #shorts #3dprinting #diy,,1:00,first person view DIY
ZFPGG35gPNM,How to fix Touch Screen sensitivity on Android Mobile? #shortsfeed,,19,first person view DIY
r64jBHi-9B0,Optical flow position hold using a smartphone camera and DIY flight controller,,1:00,first person view DIY
gABDrqirk00,Mario5 #fpv #drone #dji #cinematic #colorado #travel #love #happy #diy,,54,first person view DIY
4skNxHNgYTI,DIY FPV Drone Build from Broken E88 | Budget Micro FPV Conversion,,8:04,first person view DIY
Mho0M1Ns0Rw,How to Build a PC - Full Detailed Build Guide (2025),,1:48:09,first person view DIY
xonvTfBu0qw,How To UPGRADE Taming Flute In 99 Nights In The Forest,,16,first person view DIY
ac5EEE3furA,Arming Test | #pesawatremot #drone #fpv #diy,,40,first person view DIY
DinGqxAbgXo,FPV DIY RC TANK PART 13 #explore #diy #shots #fyp #trending #techdiy,,15,first person view DIY
pKkkbCd94PQ,DM002 DIY DRONE | DRONE PENTESTING | Dronezone  #drone #dronevideo #fpvdrone #dronehacks,,46,first person view DIY
v3YfCICcRn8,Set up wing diy before flying #wing #rc #fpv #diy,,3:01,first person view DIY
7KtZXqK_IY4,"LIDL Glider FPV Twin Plane: DIY, Test Flight #voilurefixe #fpvplane #lidlfpv #sylfpv",,17:54,first person view DIY
2vq4Y7gPHGA,Drone Arduino flight test #arduino #pid #drone #fpv #uav #stm #diy #testing #robot #motor #rc #fly,,45,first person view DIY
2oGybHlIYWM,🛸 DIY F450 Drone | First Flight Test | iNav 🚀 @INDIRC1,,4:32,first person view DIY
XBVZyJj985c,We Built a Timber Frame House on a Mountain in Maine | Shelter Builds,,45:20,first person view DIY
F0n3FgOU2m0,Avatar World New Update Airport Airpland Secret code #avatarworld #pazu #pazugames #shorts,,15,first person view DIY
dma3O4YbbOM,🟡 HX750 drone with FPV camera setup | DIY | in தமிழ் | INNOVATION DISORDER,,9:08,first person view DIY
ArDxSWccyiA,Sea Beach Beautiful view। My First Vlog #minivlog #firstvlog #seabeach,,14,first person view DIY
jJ5fKXnFjEo,Who Build First Drone? #shorts #fpv #drone #build #diy #remote #flyrobo #facts,,30,first person view DIY
rIEGjj7iF5Q,Diy FPV RC Car with Camera 😎,,59,first person view DIY
h8oLgYAy7Eg,DIY Hexa Copter takes of for the first time after upgrading its heart and brain #fpv #drone #shorts,,24,first person view DIY
fYQJpo1rY2E,Mera custom drone tyar ho gya#quadcopter #drone #djiavata #fpv #diydrone #diy,,9,first person view DIY
XZMVOpe3yaw,"how to make fpv drone goggles | DIY FPV Camera for Drone, RC Plane, RC car | diy fpv setup in Hindi",,13:29,first person view DIY
eOi6GzOyAv0,"Slow Living in the Country 🍂 Cozy Autumn Weekend, Handmade Halloween & Family Celebration",,45:34,first person view DIY
LQbsp-OZUOI,"First day back in class after the teachers' strike | CTV Your Morning Calgary for Oct. 29, 2025",,2:12:12,first person view DIY
sTE4ma8QjRg,Meeting baby brother for the first time 💞 babies view 🐣 ‪#babiesview‬ #baby #usa #america #shorts,,34,first person view DIY
DBJRk5-Lmf0,Battle of the budget planes,,7:31,first person view DIY
xFBkya6_CqM,Who had the best Rubik's Cube record? #2025 #funny #popular #shorts,,18,first person view DIY
lh7Q9JwxPt8,"🍋 my first time trying air-dry clay | sketching, painting & sculpting",,17:22,first person view DIY
S822k-TUkvM,CaddxFPV Protos - NOT What I Expected!,,13:07,first person view DIY
3R3Dbr5QB6w,RC DIY DRONE || XYQ1&2 || Ground Testing and Voltage Testing #drone #rc  #automobile #robot #flysky,,1:00,first person view DIY
0XSbgSRfamE,#rumi #huntrix #kpopedit #kpop #hair #sajaboys #bag #abstract #music #cute #ai#love #shorts #cartoon,,46,first person view DIY
uC9hVyqGvDE,I Built a $150 Autonomous Drone (Step by Step),,37:40,first person view DIY
Od_BDF-sHwg,DIY Camera drone Frame  ,,16,first person view DIY
VuU8o_5TAto,CaddxFPV PROTOS – The Beginner FPV Drone Kit That Includes Everything You Need!,,17:54,first person view DIY
ExGulYLHNiI,Botgrinder Grinderino freestyle quad update #fpv #shorts #drone #analog #4k #subscribe #diy,,1:01,first person view DIY
3C_9JXa_jZk,my first vlog#shorts,,1:20,first person view DIY
gWEfovcUtbI,"DIY Drone Review By  ""Pranav Raj"" #trendingshorts #drone #quadcopter  #dronevideo #fpv #electronic",,30,first person view DIY
EPEtPhKAflE,Indian aesthetic ✨🔶◻️💚,,16,first person view DIY
uTNkEbhESfo,FPV Goggles. #drones #fpv #drone #diy #fpvfreestyle #dji,,25,first person view DIY
1KUzEy5xEoM,Under Pressure - We Get Involved To Sort Stuff out,,46:36,first person view DIY
3hghIlAod8o,I Tested The VIRAL DeWALT Tool That Home Depot Shoppers LOVE,,12:19,first person view DIY
KckVdvNEg34,"Happymodel EP2 PWM Firmware – How to Flash, Wire & Configure",,4:43,first person view DIY
xf1ooT76KmE,Last-minute Halloween shopping at Arlene's Costumes,,1:58:30,first person view DIY
LnD-XEQ2hzQ,"Fall Asleep With Relaxing Wave Sounds at Night, Low Pitch Ocean Music for Deep Sleeping",,,first person view DIY
_bqPy05l4VQ,🚨 First Person Police Chase Stolen Ambulance Crash Caught on Camera,... #FirstPersonView #CrazyChase #RealLifeCrime #LawEnforcement #Dashcam #PoliceAction #Adrenaline #Cops #CrimeVideo ...,6:35,first person view DIY
JZujjdaqZZg,THE FUTURE OF FPV? GOOD OR BAD NEWS,,1:05:35,first person view DIY
toDmzHFHmFk,Cute OK Street High Secrets! #tocaboca,,15,first person view DIY
zJIfrufwhEA,We Finally Found the Leak! Chimney Repairs & Porch Makeover | Our 200-Year-Old Scottish Cottage Ep59,,46:38,first person view DIY
67jbcgj3dIg,Tyrese Gibson Goes Wild At Fuel Fest Fort Worth TX | Fast & Furious 2 Star Dances On Police Car,,2:04,first person view DIY
YvRRPEP2F08,GUIDE: Rust-Oleum Myths Busted | Real Efficiency & DIY Spray Techniques,,18:59,first person view DIY
X9nI7K0ExnQ,One Simple Step To Beat Analysis Paralysis,,40:03,first person view DIY
pvp2rxtOc38,The Best Cinematic Drone Is Fragile...,,2:15:59,first person view DIY
s-Q7w9UC-24,First look of the Makera Z1 CNC machine,,17:01,first person view DIY
KSMnTWuld1g,Sanae Takaichi named Japan's first female prime minister |  DW News,,6:34,first person view DIY
IQpn0vMJzKU,My Cultivation Speed is 1000x FASTER! The SECRET? EASTERN QI Perfects Their Magic!,,30:53:01,first person view DIY
WyIYuzWMmFg,My Pregnant Wife Was My Mission Control and Everything Went Wrong,,13:32,first person view DIY
wZlViCPCWJw,I built the world's smallest FPV drone,,29:16,first person view DIY
SJaYxTutj9E,🔲 5 TIPS To Make THE BEST LAGOONS In Jurassic World Evolution 3,,15:28,first person view DIY
5FsBHHfr3Ew,The cutest godchild 🥰 babies view 🐣 #babiesview #baby #tiktok #babygirl,,9,first person view DIY
WxoCwWQkVYg,How To Fix Audi A4 Rear View Mirror - Step By Step,,1:49,first person view DIY
7vOH7RWUqq4,🐹Golden Retriever Puppy Love! | POV Video | Cute Dog|#Shorts#GoldenRetriever#Dog#The Fursionista#pov,,39,first person view DIY
JXh43m_fNN0,How Local Businesses Can Rank on Google With YouTube,,1:59:34,first person view DIY
z8pqNfEsmDk,🎮✈️ FPV Drone in the Octozone 🐙💕 #shorts #FPV #Drone,,17,first person view DIY
6c4f4C2XsjM,HOW TO DOWNLOAD WARZONE MOBILE IN 2025 IOS & ANDROID AFTER SHUT DOWN,,9:22,first person view DIY
r25mDWHh9ho,"I made this sold out coat, it’s reversible | WITHWENDY",,24:01,first person view DIY
nJeFOIhOYQE,Tutorial: How to Automate Nintendo Switch Controller Inputs - CollectiveMinds Switch Up Macro Mode,,4:42,first person view DIY
04Vj5uR7plw,F-22 Raptor RC – Insane Power and Speed!,,20,first person view DIY
mMVxenozJ7M,KPOP DEMON HUNTERS 2 - Trailer (2027) Netflix & Sony Animation,,1:14,first person view DIY
T3a7yAUoWcw,"B.C. to launch anti-tariff ads | CTV Your Morning Vancouver for Tuesday, Oct. 28",,2:16:40,first person view DIY
-eOkcCPJEzI,I Built a Powerful Paint Mixer for UNDER 10€ (It Actually Works!) 🛠️🎨,,3:38,first person view DIY
5ZmdxH7qBew,The Instant Gardener,,45:02,first person view DIY
CGTDVNBHYBM,Truck Setup Regrets? Accessories & Hitch Install (And What We’d Change),,27:36,first person view DIY
01PiJ4QXGXY,BARNHOUSE HOME TOUR BEFORE + AFTER TRANSFORMATION | SMALL HOME TOUR WITH REMODEL PRICES + LINKS,,20:36,first person view DIY
kw1B9QqWPzg,How To Replace Side View Mirror Kia Optima (Full Guide),,1:52,first person view DIY
Ad0HCvdfECk,How to Make Remote Control Airplanes | Cardboard Art and Crafts| Dc Motor aroplane ,,9:00,first person view DIY
V2K2WkdbwYw,Van Life in the SAHARA Desert!,,23:32,first person view DIY
eZ0vpuwmXBw,"PII Testimonial #7: Monique | INSPIRATIONAL 56 Year Old Single Mom of 3 ""PII Changed our Lives""",,44:37,first person view DIY
woEGYy9obSI,"After breaking off with my ex, I married my cold, ruthless CEO boss, who now spoils me endlessly!",,3:13:03,first person view DIY
bAIlG2yJpq8,TODAY Show Full Episode - October 22,,1:07:44,first person view DIY
LmBKNBd2gRA,funnyvideo #comedy #hilarious #lol #funny #funnymoments #pranks #fail #epicfail #fun #laugh,,13,first person view DIY
y4MYsUC6kfU,I turned The Mobula 8 Into A Mobula GREAT!,,10:09,first person view DIY
5wK1cf8oKHs,"Another B.C. Conservative exits party | CTV Your Morning Vancouver for Oct. 21, 2025",,2:16:40,first person view DIY
M3jQBm-XWMQ,"FIMI X8T Thermal Drone – Triple Camera Power for Solar, Roof & Night Rescue Missions",,22:25,first person view DIY
jfJ9DFRSNdQ,my first blog nature||जंगल में घूमने गए🦁||my first vlogs 2025😍||#shortsvideo #shortvlogs #vlogger 😍😍,,45,first person view DIY
66WYw2cUeYU,शहर में रहना आसान नहीं हैं 😭😭😭 #funny #ख़बर1इंडिया #youtubeshorts #comedy #shorts #ytshorts #shahar,,48,first person view DIY
C_3Lql4bwm0,This Lowe’s Miter Saw Is Blowing People’s Minds (You’ll See Why),,16:21,first person view DIY
IAcNtIwijps,"*""Risivar Ki Asli Testing: Shocking Result!""",,8:44,first person view DIY
cZ0ZoSfc3Bk,DIY Photo Shoot at Home!  How to Take Portraits With Your Phone!,,8:35,first person view DIY
myflsWmpmgQ,The Red Lottery Ticket 🎫💰 | A Twist of Fate by Fortuné Du Boisgobey,,4:50:35,first person view DIY
3ebI7ihMF4M,🎩 Mr. Grex of Monte Carlo 🌊✨,,8:43:24,first person view DIY
BMsCxssFCRM,funnyvideo #comedy #hilarious #lol #funny #funnymoments #pranks #fail #epicfail #fun #laugh,,12,first person view DIY
3-x6RLLSHcs,#anime #animeboy #animeart #animeedit #animals #zoro #luffy #onepiece #japan #public #memes #trailer,,6,first person view DIY
wi7pYV0-BgA,How To Build the Graco Hadley Baby Crib with Drawer (Visual Guide to Use with Instruction Manual),,8:13,first person view DIY
oIGP6MJyQM0,No reno bathroom makeover (transforming our builder grade bathroom),,7:52,first person view DIY
6KYJE3VmBTU,Camping Chair Hack!,,44,first person view DIY
Xij_kLd9FOc,"The Lady from Nowhere: A Detective Story 🕵️‍♀️🔍 | Murder, Mystery, and Suspense",,5:29:25,first person view DIY
GDV7kjua4rE,🕵️‍♂️ The Mystery of Angelina Frood 🔍 A Dr. Thorndyke Investigation!,,8:59:53,first person view DIY
BF2Bbx-Bvw0,Endoscope Camera with Light,,8,first person view DIY
oafQLcK4BzI,funnyvideo #comedy #hilarious #lol #funny #funnymoments #pranks #fail #epicfail #fun #laugh,,16,first person view DIY
-J3Xl6cwI80,funnyvideo🥵🥵😭 #comedy #hilarious #lol #funny #funnymoments #pranks #fail #epicfail #fun #laugh,,16,first person view DIY
bWJHIYUSRqk,"Grand Egyptian Museum GEM: King Tut’s Complete 5,000+ Treasures Revealed.",,1:53,first person view DIY
kFhIWdxuNTE,"Grand Egyptian Museum GEM: King Tut’s Complete 5,000+ Treasures Revealed.",,1:46,first person view DIY
lTcP75OgT7I,"Grand Egyptian Museum GEM: King Tut’s Complete 5,000+ Treasures Revealed.",,1:04,first person view DIY
XxLExOnP1mg,"Grand Egyptian Museum GEM: King Tut’s Complete 5,000+ Treasures Revealed.",,1:04,first person view DIY
ehVrW80xu6Y,",😭😭funnyvideo #comedy #hilarious #lol #funny #funnymoments #pranks #fail #epicfail #fun #laugh",,18,first person view DIY
1a9J7YEfGjo,Kaslai Diu Yo Jovan | Nikhil Upreti | Dilip Rajmajhi | Jharana Thapa | Melina Manandhar,,2:31:12,first person view DIY
aRPMpPVt3GY,funnyvideo #comedy #hilarious #lol #funny #funnymoments #pranks #fail #epicfail #fun #laugh,,20,first person view DIY
pmgSvkoDKhc,aor wo maja nahi duniya kye kisi kone me jo maja hai subh jag kar fher sone me mama 😜 #funny,,17,first person view DIY
buZHg4UTBAU,Designer Cotton Candy 🍭 #ytshorts #cottoncandy #candycrush #manikemove #viralshorts #topchannel,,17,first person view DIY
ZtqDkevdMVw,Burrraahh - Full Punjabi Movie,,1:53:34,first person view DIY
VOGr9dIUXuo,#handwritelogo logo kaise banaye #shorts #design,,27,first person view DIY
Isv9lww880o,"People hate Frieren. For ""objective"" reasons | Frieren: Beyond Journey's End",,59,first person view DIY
SUUN74-XNWY,back to Arunachal Pradesh #religion # Buddha # namsai,,12,first person view DIY
a5j82IwHVXU,Funland/GSM Mall/Ramnad/karunas realms of fantasy,,16,first person view DIY
Y-hzri5Udzs,1 - Setting up the First-Person Animation Tool,,2:07,first person tool demonstration
bpGHI4rDocA,ATAK-Civ Tutorial B14: First Person Tool,,1:44,first person tool demonstration
bou9RzMZNks,First Person Immersive Animation Tool,,5:16,first person tool demonstration
VzYxsanpuH4,DevLog.27 First Person Tool Item Test Will update soon,,1:48,first person tool demonstration
f3c4mQty_so,I Tried the First Humanoid Home Robot. It Got Weird. | WSJ,,9:15,first person tool demonstration
wrnD1MASAgY,FPS Mesh Tool - Setting up UCC First Person Materials,,1:27,first person tool demonstration
xijqQVUHxVU,Everyone Needs This Tool!,,18,first person tool demonstration
Mc4vXQcDy80,Face to Face with a Wild Leopard on Karnataka Highway #wildlifeencounter #leopardsighting,,21,first person tool demonstration
tdrBtSZXJBY,DELETE AFTER WATCHING,,46,first person tool demonstration
aSVXyQHbb7M,FIRST PERSON TOOL VIEW #hardwork #dedication #blockwork #masonry #video #grind #masons #florida,,40,first person tool demonstration
