id,title,description,duration_string,search_keyword
bCOMKjZjCmA,Complete Root Words | English for All Bank Exams | English By Anubhav Sir,,1:51:32,egocentric view workshop
az5bl6dIMQ4,The truth about egocentrism,,1:23,egocentric view workshop
m3CqH4DjVlI,15 woodworking basics you should know,,13:20,first person woodworking
w7nkU1aqr8Q,Day in the life of a 21 y.o. Carpenter (First Person POV),,12:12,first person woodworking
1CbF3nS7oOY,Raw GoPro Floor Sheeting - FIRST PERSON POV,,23:49,first person woodworking
QgMGZLm5_38,Building A House Start To Finish In 7 Days!,,3:41:37,first person woodworking
Abizr1BiHQM,Work smarter not harder! How would have you done this? #construction,1st year apprentice ...,16,first person woodworking
USmD51VS75w,"FIRST PERSON | At 63, wood is the medium I use to explore my Indigenous roots",,4:53,first person woodworking
aAAksidU9Yo,How this boy made the first car in his Village,,3:57,first person woodworking
8wK8xrm467g,Building a Roof - Wood Framing (First Person POV),,36:36,first person woodworking
AgnSfUoEsIw,Start a Woodworking Business from Nothing (Simple Strategy),,21:30,first person woodworking
j74evEphdw8,180 Days A Man Built This Huge House Alone,,35:08,first person woodworking
MBvDugT2rng,first person carpentry,,8:04,first person woodworking
GlsCRChrdfU,Framer Building Interior Walls // POV,,6:45,first person woodworking
miGWz-EiRNQ,First Person Revealer,,55,first person woodworking
aniTmNgu-qM,First Person Florist,,3:41,first person woodworking
WwzkeNnsNtM,First-person perspective experience of high-altitude logging. High-altitude logging occurs,,1:47,first person woodworking
nlsmOoPTjLs,Easy Beginner Woodworking projects that sell for High Profit,,12:02,first person woodworking
PcfF58syR5c,Wood joints #woodworking #woodwork #tips #diy,,16,first person woodworking
pYJXTrBgoak,"Relax, it’s art 🪵 #carving #woodcarving #woodworking #woodworkingart #nature #relaxing",,33,first person woodworking
HHw8J2kZazs,First person POV use of Vgroove blade,,38,first person woodworking
cagYqNJrFnA,Top 6 Japanese Woodworking Projects for Beginners,,25:32,first person woodworking
bF_RMmfNPxI,First Person Point of View showcasing Robots at work! #woodworking #amazing #timelapse,,22,first person woodworking
1LTptgT3TJo,Build a Simple Workbench with Wood #woodworking #furnituremaker,,29,first person woodworking
MFcvxKQeWj0,🪵Get an immersive wood-cutting experience through first-person view!,,18,first person woodworking
Zyw2p66E8Nk,Working with a planer in the first person #shorts,,19,first person woodworking
JINjHLLzRfE,First person caulking! #woodwork #build #diy #work #construction #carpentry #firstperson #painting,,21,first person woodworking
uM9cnmkqLYQ,Build a Workbench in 1 Hour #woodworking #diy #workbench #shorts #storage #howto #howtomake #easy,,1:00,first person woodworking
5PMdo5bAmCg,chopping wood from the first person #wood #skills #woodworking,,12,first person woodworking
HGjBD8TAbcU,The first person to do this trick we named it the V-clamp.,,10,first person woodworking
o40JxvvmPL0,More limbing in first person mode. #chainsaw #diy #trees,,1:00,first person woodworking
skXD_knr-HY,This Car Is Entirely Made Of Wood!,,34,first person woodworking
PWA8UuZtuc8,Super Simple Scrap Wood Project,,30,first person woodworking
y8W7KbJTg7A,Carpentry 101: Basics of Wood Framing with MattBangsWood [#1],,17:03,first person woodworking
Pv6UyKTFPwM,Best Router for Beginner? #woodworking,,51,first person woodworking
-Ecb7zJob7Q,$250 to $7700,,1:00,first person woodworking
PhG3OiJ9zpQ,I Made a Giant Wooden Duckhunt Arcade Game! | #woodworking #viral #awesome,,11,first person woodworking
WOZMhp8diCQ,Creative hidden-compartment wooden chairs #furniture #woodworking #diy #asmr,,13,first person woodworking
JaEWe3tWwIw,This only takes Three 2x4s. Huge Profit,,16:55,first person woodworking
cV_i2EdfV1I,Your Warhammer army deserve the ultimate battlefield ⚔️,,11,first person woodworking
1RR5ryyNpT4,Boss Blue Collar Skills Challenge first person view #challenge #bluecollar #tools,,19,first person woodworking
G_lKgZZ6Dhg,I Build the First Smart Hand Tool Woodworking Workbench,,32:55,first person woodworking
uPagpWQVD_4,Sending a Big Fir Top! 🌲 #shorts,,43,first person woodworking
7GU7-D60pb8,"9 Tools to Start Woodworking for Under $1,000",,59,first person woodworking
xF_JmLCCTtM,difficult for first man #carpentry #forest #wood #woodwork #lifting #woodworking #amazing,,19,first person woodworking
vek049MUK0o,Best First Hand Tools and First Projects for Hand Tool Woodworking,,16:10,first person woodworking
Bi-O3CxQFdU,Build this if you want NON-STOP sales.,,56,first person woodworking
f56ppr0rq1k,1890s Perfect Pointer Pencil Sharpener,,16,first person woodworking
ejJe4piBVF4,Watch and learn #framing #framers #construction,,20,first person woodworking
3dxfN_FKdlI,Let’s Make a River Table! #epoxy #resin #table #woodworking,,22,first person woodworking
rCdRsbQiz28,My Top 5 Best Selling Woodworking Projects #Shorts,,47,first person woodworking
RMU4k1KTdnw,How to Choose a Woodworking Workbench,,19:05,first person woodworking
ji1N8NwKMg0,satisfying throws #shorts #framing #construction #carpentry,,42,first person woodworking
UasCxRtej4Q,dont waste money on a jointer,,58,first person woodworking
OORBqjhMvtQ,City Oak sample cabinet door first person perspective video by Barker Modern Cabinets,,36,first person woodworking
ZDW7mx6jz9k,Helpful construction tips you should learn from the experience carpenter #carpentry #wood #skills,,18,first person woodworking
aJjLBvnv87k,First Person Milling 😄 | #wood #chainsaw #diy #lumber #alaskanmill #stihl #lumberjack #powertools,,1:01,first person woodworking
AFzdMxCH1jY,First person wood slicing #woodworking #asmr #shorts,,15,first person woodworking
tSlzt15Bi8I,HOW TO Fix Gaps in Laminate wood Flooring #howto #diy #shorts #homeimprovement,,15,first person woodworking
ls6_KOd-KPk,#birdtrend,,15,first person woodworking
7TzblVO0POU,Don't Buy the Wrong Router #woodworking,,38,first person woodworking
CHICPtZhy7A,Replace any gate in under a hour.. #diy,,37,first person woodworking
hM8ymHYJXtY,How to lay laminate flooring #flooringexperts #diy #doityourself,,15,first person woodworking
40oN-wH5F4c,How Many Swings to Sink a Nail?,,52,first person woodworking
lKZaIUNh3j0,Backdrop setup,,11,first person woodworking
YUtthaJze7g,Making a Estuary River & live edge Walnut dining table,,1:00,first person woodworking
QZH32AmqiEA,How To Start A Fire Like A PROFESSIONAL Homeowner Wranglerstar #shorts,,36,first person woodworking
L1NYlxvpXio,Her first time and she loved it! 😍 #shorts #woodworking #family,,21,first person woodworking
baPzCBpLVrE,How Chainsaw Kickback Works 😬,,24,first person woodworking
ct1eJcm3koU,Crazy fast chainsaw incredible skills,,8,first person woodworking
fnEPYg2cb1g,Quickly Make A Chair,,58,first person woodworking
uPT-469Q1Yw,first woodworking project. made an oak table with metal legs. sits 6 people,,18,first person woodworking
7DyaL7M47_A,Axe chopping tutorial for the little guy to chop BIG wood,,44,first person woodworking
u3sIALGuyTA,How To Measure And Cut Stair Stringers,,1:00,first person woodworking
qQJCx5cWHPg,FIRST PERSON VIEW CARPENTRY #fpv #carpentry #live #subscribe,,1:01,first person woodworking
hYyUAi9_1cg,Traditional Japanese joinery #carpentry #building #joinery #home #handcrafted #handmade,,1:01,first person woodworking
y_ht6U14LYQ,the dog the first person to#reddit#redditreadings #woodworking,,1:01,first person woodworking
hWTMQSTHUAo,Need Christmas Money? Turn 1 $4 Fence Picket to $25,,20:55,first person woodworking
_OCBUABkgH4,he was the first person to #reddit #redditreadings #woodworking,,1:01,first person woodworking
lFvhJ5ECeMI,Easy button for cabinet building! #woodworking #woodwork #diy #build #design #cabinet,,49,first person woodworking
l1zhga0fi6g,How This Expensive Wood Is Made 🤔,,31,first person woodworking
KGUSEKVjhVE,Old boy carpenter shows us... #carpenter #fyp #construction,,19,first person woodworking
C6CfQMS5azQ,3 Tier Pedestal Build #diy #woodworking #furniture #viralvideo #diycrafts #diyprojects #tutorial,,21,first person woodworking
QfpQngpbpAE,Indian Fast Shaving #indianbarber#asmrsounds#oldbarber#barber #haircut #asmr #asmrbarber#shave,,20,first person woodworking
LJ5ZzfbL-WU,Man Nearly Crushed by Log While Unloading Truck#safetyfail #closecall #ouch #woodworking,,10,first person woodworking
ANagvkBirHw,Rip first for efficiency advice #woodworking #carpentry #diy #wood #woodwork #woodworker,,21,first person woodworking
e5fZm3lwZCk,1st Person To Guess Name Wins $100 #shorts #music #funny #pov #wordgasm,,57,first person woodworking
Z1kmdL4ksdI,front door design🚪👌👌 #woodworking #wood #shorts #viralshorts #deepwoodworking #door,,13,first person woodworking
wPNW1ECXYpc,This is a must have tool for installing hardwood flooring #flooring #carpentry #tools,,12,first person woodworking
bzyJER5zXfA,#reddit #diy #woodworking #fyp #satisfying,,54,first person woodworking
5NJwOML7GRQ,people whose first relationship was very long term#aşk #woodworking #reddit #shortvideos,,1:01,first person woodworking
IjzlR5xxZrc,চীনারা ফাঁপা গাছ দিয়ে কি তৈরি করে দেখুন | woodwork,,19,first person woodworking
m_hl1yrlLL8,How to Shoot a Bow and Arrow (Beginner's Guide),,12,first person woodworking
A2QDdMSDXqk,Splitting Position,,20,first person woodworking
oEaB_X23ifc,The 3 Circular Saw Tips Every Beginner Should Know!,,5:56,first person woodworking
ssR4nvQpJLM,Framing a Custom Home - A First Person POV and Time-Lapse,,16:44,first person woodworking
NtHfaEsdGoE,FIRST PERSON WHO IS HONEST GITS THE DOLLAR.  #SHORT'S,,18,first person woodworking
SiGz-cX01yE,#wood #satisfying #woodworking #woodwork #lifeisbutadream #diy,,45,first person woodworking
jDuuBp7KP0g,people who quit their jobs on the first day #ask #shortvideos #woodworking #reddit,,1:01,first person woodworking
b1FLM8r4ygg,Amazing wood working video #woodworking #carpentry #furniture #shortvideo,,29,first person woodworking
_TcPrznjlEc,First-person Perspective Tile Cutting by TILER T3 Tile Cutter#tiling #tilecutter #homeimprovement,,14,first person woodworking
dETcW_04wGw,"Small woodworking projects, and First-person Camera hacking!",,5:02:18,first person woodworking
kUowf0TEkMI,when did you first realize life#ask #reddit #shortvideos #woodworking,,1:01,first person woodworking
4NmvnnUzc-s,"Flip the Hammer, Sink the Nail",,58,first person woodworking
7t-ta87hPqg,3 Kickflips on CRAZY Boards,,16,first person woodworking
iewRun2GqaA,Transforming Wood into $500 Charcuterie Board! #shorts #diy,,1:00,first person woodworking
f2bjiX6Ux_c,Who Sunk the Nail?,,32,first person woodworking
zPH6KA07xJQ,were warned when we hired our first human crew member#shortvideos #woodworking #ask #redditstory,,1:01,first person woodworking
kWZtzR_Fo-E,5 Beginner Woodworking Tips I Wish I Knew Sooner,,17:40,first person woodworking
v1stb9Udo5s,NEVER do this at the Table Saw #woodworkingtools,,28,first person woodworking
CP-bMbLXHi0,Carpenter work desi jugad ke sath #shorts #carpenter #kkfurniture #woodworking,,15,first person woodworking
GlwBhOLM7Bk,people who quit their jobs on the first day #shortvideos #woodworking #ask #reddit,,1:00,first person woodworking
lHPlbvm13Q8,#wood #satisfying #lifeisbutadream #carpentry #reddit #woodwork #diy,,59,first person woodworking
mRS-33Djl8I,Warm & Cozy Teepee Shelter Build,,1:00,first person woodworking
moVK30zqs7c,Installing Home Insulation: A First-Person Guide to Better Comfort and Efficiency #insulation #usa,,42,first person woodworking
py9xxU549f0,that this wasn't the first time#shortvideos #ask #reddittask #woodworking,,1:01,first person woodworking
pSpzoeHmW6I,"The $1,600 Chainsaw You Should Buy!",,19,first person woodworking
JsJ7sNJkqi4,fact that would shock most people#woodworking #reddit #shortvideos #ask,,1:01,first person woodworking
jTV2rLNcyeI,"1st Woodturning in person live demo, tick ✓ #woodturning #woodworking #creator #celebration",,35,first person woodworking
Ieq_d6KTaQw,How Cast Saws Don’t Hurt Your Skin 🤔,,36,first person woodworking
rNtCqCm__2U,The BEST way to light a log burner #woodstove #logburner  #lifehacks #fire,,54,first person woodworking
jnvyt5Sg4Co,people whose first relationship was very #reddit #woodworking #reddit#redditreadings,,16,first person woodworking
kwmM7WhyAPg,Precision Shuffleboard Challenge!,,30,first person woodworking
Q8c49kU_zQY,people whose first relationship was very#reddit#redditreadings #woodworking,,1:01,first person woodworking
3_COZnD6Xeg,Easy money!  #woodworking #kitchen #kitchentools #maker #smallbusiness #craft #lathe #tools,,55,first person woodworking
auYvQnFU5zE,when did you first realize life#shortvideos #ask #woodworking #reddit,,1:01,first person woodworking
_vGvRp_sT5M,people whose first relationship was very long term #reddit #woodworking #diy,,1:00,first person woodworking
9wNi2_RgV48,(PUBG MOBILE) ! Assault Map #woodworking #viral,,16,first person woodworking
LRFJtA8sX5k,How I Train the 1 Inch Punch,,13,first person woodworking
Pbs9Y8IVyfE,Safety door design Home Furniture Home Interior Interior design #interiordesign #nashik #safetydoor,,9,first person woodworking
2uG30s9Km2M,"How to frame and install a wall, plumb, square and level! #construction #diy #frame",,46,first person woodworking
jLqHTKCpbwc,The Genius Wood Marking Trick | Perfect Fit Every Time 🔧✨ #woodworking #diy #woodart #shorts,,43,first person woodworking
-7c9tVTiZUY,The First Cut is Always the Coolest! #woodworking #wood #bandsaw,,31,first person woodworking
muU0_e0jsU4,FIRST Person Dice Stacking!🤯 #viral #trickshot #shorts #bosslevel,,13,first person woodworking
rSZeu8guVIY,The First 5 Power Tools Every Beginner Woodworker Should Buy,,12:44,first person woodworking
ZPYlt35bMfg,Shooting an INSANE Double Recurve Bow,,10,first person woodworking
TYD3ZCq05Rk,The Original Guru At Work #doorrepairs #diy #doorway #doorconstruction #woodworking,,1:00,first person woodworking
1HzovCAUULI,the dog the first person to #reddit #redditreadings #woodworking,,1:01,first person woodworking
h7YJT2oDZiU,"Lou Crickett, volunteer lumberjack. 🪵🫱🏼‍🫲🏽 #rdr2 #rdr2rp #woodworking #roleplay",,24,first person woodworking
cF1YK8qrx3w,First person to meet a cow,,42,first person woodworking
gV7UR57q1X0,people who quit their jobs on the first day #woodworking #reddit,,1:01,first person woodworking
Cd1oIhiEZAQ,The Drill Every Woodworker Needs,,51,first person woodworking
hqB-kjPUXQQ,people who quit their jobs on the first day #woodworking #reddit,,1:01,first person woodworking
f-bxaA1bL9w,People who quit their jobs on the first day #reddit #woodworking #ask,,1:01,first person woodworking
CnUQ8DcsZ9U,New Cutting Board,,28,first person woodworking
Lru3vX7Q8oA,3 Easy Woodworking Projects That Sell Fast,,22:58,first person woodworking
Bl2BTnioZUo,people whose first relationship was very long term#ask #shortvideos #woodworking #reddit,,1:01,first person woodworking
X1tfbltZ6OM,A First Person Insight into  Preparing a Surface for Picture Hanging Fixing System.,,8,first person woodworking
XpRKjzQRFoA,people whose first relationship was very long term #ask #shortvideos #woodworking #reddit,,1:01,first person woodworking
GBfkkR5hM6U,Turning Old Sawmill Blades into Knives | How It’s Made | Science Channel,,1:00,first person woodworking
AAtoBsIKZXA,🌲 BRILLIANT Christmas Wood Projects ANYONE can do! (All Under $10!) High-end Budget Christmas DIYs,,32:39,first person woodworking
5-NEiN0ojVM,How to make a wardrobe #wardrobe  #shorts #shortsfeed  #woodworking  #shortvideo,,43,first person woodworking
9FwDRtQu21w,people whose first relationship was very#aşk #woodworking #reddit #shortvideos,,1:01,first person woodworking
cVsq6RBjWyM,INGCO 3-in-1 Staple Nail Gun Kit – Perfect for Carpentry & DIY Projects!,,31,first person woodworking
uNhdMafE7Rs,My one of the best gameplay #woodworking #popular #proplayer,,1:00,first person woodworking
tawN2Z79snQ,The first person I love #I want to be popular #Leaf carving photos #I have everything you want,,15,first person woodworking
rCT1R_pMXRk,#reddit #diy #woodworking #fyp #satisfying,,54,first person woodworking
7FQApWzHhIg,people whose first relationship was very long term #ask #shortvideos #woodworking #reddit,,1:01,first person woodworking
wpDRV8yvqME,$1 Arcade Punching Bag HACK,,1:00,first person woodworking
uA5v6ajrRdo,#woodscraft #woodworking #cnc #carpentry,,1:00,first person woodworking
DlE0Oyb9GVI,First person to say “I’ve lifted bigger beams all by myself” gets 5 points. #beams #roof,,14,first person woodworking
Wbju9myFR_s,Door Install Trick - DON'T SCREW THROUGH THE HINGE!!!,,43,first person woodworking
d8zOfYKi-c4,How to Make a Robotic Arm from Cardboard #shorts #lifehacks,,15,first person woodworking
rGp4D7YCTNg,Father Nature! 🍃Tribute to the Cocoa tree where it all begins!,,1:01,first person woodworking
Mx8qS9blMUs,Insane First Person Shot 🔥 #shorts #tiktok #viral #trending #trickshots #dudeperfect #respect,,6,first person woodworking
N8u6CwN21q4,#woodworking #ask#shortvideos#redditis,,1:01,first person woodworking
-azmWW_UStE,Fpp really jod #woodworking #woodcarving #wood #shorts #bgmi #pubg #youtubeshorts #anime #carry,,40,first person woodworking
X1ixHPWiMx8,First-person perspective experience of monorail push knife cutting  #viralvideo #youtubeshorts,,20,first person woodworking
cmdXbkgjwys,Clip&Rip   First Person Installs,,1:02,first person woodworking
T2s7ez7LScg,1vs1 ROOM PUBG GAMEPLAY 😨#woodworking #youtubeshorts,,3:01,first person woodworking
O7Pvd51UYNU,pubg gaming pro #oppigaming #pubgmobilewinnerwinnerchickendinner #woodworking,,15,first person woodworking
0Q2XNh7UaMk,#askredditstory #woodworking people whose first relationship was very long term,,1:00,first person woodworking
WlpLnkQj0Pc,shoot out gunfiring level 14 #viral #trendingshorts #popular #woodworking #woodworkingart,,25,first person woodworking
68zqvXa_PSE,Only when you have nothing to do will you care  #Driving first-person perspective #Fixed camera,,16,first person woodworking
8ADc8TCxWCM,was literally the first person I met when I moved to town in 1995. Now we fix historic homes togeth,,33,first person woodworking
ZjTo9NdFH5s,Home Inspector Finds a VERY WELL BUILT Deck,,1:00,first person woodworking
eMpsZjwMFug,First Person Marker Flip #shorts #trickshorts #trickshot #dudeperfect #bottleflip #markerflip,,4,first person woodworking
8NFghNjnl8o,#Reddit #diy #woodworking #fyp #satisfying#ask,,54,first person woodworking
vVRU2ENFTCM,#reddit #diy #woodworking #fyp #satisfying,,1:01,first person woodworking
XgnTqgm2LK0,There's a DIY for everyone. Outdoor Sofa Set Part Three,,1:01,first person woodworking
8QUlY9tTjrA,How to Build a Wood Fence Gate (Step By Step),,13:12,first person woodworking
cHB5EBzEA5M,first time liteheroicWood working art and craft #viral #trandingshorts #popular #woodworking,,15,first person woodworking
uOCcriPNHYg,fact that the world needs#ask #shortvideos #woodworking #reddit,,1:01,first person woodworking
EkRnfslUmbE,Why are People Obsessed With Pocket Knives 🤔,,22,first person woodworking
El-RRmCwIaQ,First person #constructionlife #constructionchannel #caulking #tools #building #shorts #construction,,18,first person woodworking
bVjlkNZtlxE,Indoor FPV Drone Cinematic: One-Take Tour of a Woodworking Craftsman at Work  #fpv #fpvdrone #drone,,16,first person woodworking
A3omcmUbze8,Cool First Person Trickshot! 🔥 #shorts,,4,first person woodworking
doKTQXvYn2Q,[Royale Arena ] 👈🏻 #popular #trendingshorts #trendingshorts #pubg #pubgmobile #viral #woodworking,,3:01,first person woodworking
vD3cIiFt0P4,How To Frame A Gable End Overhang,,1:00,first person woodworking
1sssQLGC2qE,1v4😈😈in freefire😍😈😈😱🥵#shorts #woodworking #woodwork #trending #viral #popular #woodcarving,,34,first person woodworking
PmAyCvkDrYo,MY LEFT PEEK ON FIRE☠️ #shorts #trendingshorts #jonathangaming #bgmi #pubgmobile #woodworking #viral,,22,first person woodworking
GrvXBMF9xXE,Woodworking Art | Get Amazing Results With Color Stain | Shou Sugi Ban,,8:11,first person woodworking
mFYb7CrHbX4,#diy #wood #reddit #woodwork #woodworking,,1:00,first person woodworking
kpz_5ElpbAQ,#wood #redditstories #woodworking #satisfying,,1:00,first person woodworking
bTtDNqnnkqs,Watch How I create 2 Different Wood Finishes with the Retique It Kit,,33,first person woodworking
COQ5V3Imumw,How This Ancient Chinese Puzzle Lock Works 🧐,,34,first person woodworking
EMm-Xq38ctw,#birdtrend,,20,first person woodworking
xLxCEBb-74s,How to use a Router | Woodworking Guide for Beginners,,13:04,first person woodworking
KszrZtUSbcc,people whose first relationship was very #reddit #redditreadings #woodworking,,1:01,first person woodworking
z3o1jqehMoQ,TDM GAMES wood working art and craft #viral #trendingshorts #popular #woodworking #woodworking,,16,first person woodworking
3g4aMXKQuVU,sausage man #woodworking #woodworking #fortnite,,38,first person woodworking
PUldy_ocsh0,First person simple trick shots #shorts,,16,first person woodworking
dQthEBUmzzY,#battlegroundmobileindiamontagepubgmobilemontage #bgmi #gaming #wood#woodworking #woodcarving,,44,first person woodworking
6EaiE6CGTsk,Qudra takedown in cs rank #shortvideo #viralvideo #gaming #woodworking,,23,first person woodworking
V40t_che4iI,a month from people in First#ask #reddit #shortvideos #woodworking,,1:01,first person woodworking
aoIiOHOV9hs,people who quit their jobs on the first day #woodworking #reddit #shortvideos #ask,,1:00,first person woodworking
1IotjpIZvAg,How Record Players Actually Work!,,52,first person woodworking
NmQtBq1VLwM,First person Scaffolding walk through,,16,first person woodworking
D-tayxDmABk,#satisfying #redditstories #woodworking,,54,first person woodworking
ogQ1V6pG5kk,NEW TDM GAMEPLAY 1vs1 ROOM #woodworking #bgmi #pubgmobile #viral #pubg,,3:01,first person woodworking
x8fQhpVW21Y,headshot wood working art and craft #viral #trendingshorts #popular #woodworking #woodworkkingart,,1:01,first person woodworking
HfyMYjHeAUM,#popular #woodworking #gloweffect #trendingshorts #ffedit,,32,first person woodworking
Gv0lutUsv50,#reddit #diy #woodworking #fyp #satisfying,,1:00,first person woodworking
vB6UZ73i5Kw,Woodworking Project to Sell ~ Using only a 2x4,,3:22,first person woodworking
YApg1cMgieU,how can you tell you're entering #reddit #redditreadings #woodworking #storytime,,1:01,first person woodworking
xe3QOLrIekE,#bgmi #viralshort #woodworking,,33,first person woodworking
D8ndrRSknMY,This tool makes the work look like magic 😲,,16,first person woodworking
Y2sq9KhUKuU,First person simple trick shot regular vs reverse 😱🤯 #shorts,,12,first person woodworking
y8s_Aup2uk4,1VS3🥶 #viral #trendingshorts #popular #woodworking #woodworkingart #bgmi #pubgmobile #jonathan,,31,first person woodworking
J6tXh9ImSbQ,#garenafreefire #viralshort #carpentry #ajjubhaiinmymatch #woodwork #woodworking #geography #ajjubh,,15,first person woodworking
ulGrvTUkdfM,First Person Skateboarding! Back 505 Front Shuv #shorts #skateboarding #skate #skateboard,,11,first person woodworking
sfUASJkBG1M,random cod mobile 😉😉 #woodworking #yosoydelos7mil #diy #wood #home #automobile #art #woodwork,,35,first person woodworking
uVxGuA69ODs,#battlegroundmobileindiamontagepubgmobilemontage#bgmi#gaming#woodwork #woodworking,,32,first person woodworking
YKU2dIL-b6Q,people whose first relationship was very long term #reddit #woodworking #ask #shortvideos,,59,first person woodworking
hBNMPhXNk48,Attempting the Jigsaw Puzzle World Record,,39,first person woodworking
YhVB_hAfET8,#aşk #wood #working #woodwork #woodworking,,55,first person woodworking
IK-woqLHBJ0,Security cam vs First Person | Front Board #skate #skateboarding #shorts #explore #skating #viral,,8,first person woodworking
xIaaZ-EB_mA,LIVIK GAMEPLAY  SHORTS #woodworking #pubgmobile #bgmi #viral #pubgmobile,,15,first person woodworking
TMZzlfIVfZw,#67#fort #woodworking #kitchen,,16,first person woodworking
8Vnu56vOKYU,BGMI gameplay #1 #viral #popular #trending #woodworking #BGMI#woodworkingart,,23,first person woodworking
1DnlHT19HU8,Lounge Brown sample cabinet door first person perspective video by Barker Modern Cabinets,,30,first person woodworking
rQ2dsQ7svgM,"STIHL MSA 140 C-BQ Chainsaw | ""first person"" camera",,1:03,first person woodworking
Il-hk3bAPJ8,Threshing by Hand: The Ancient Rhythm of Grain Harvesting,,7,first person woodworking
pTbjBbefCqk,French Grey sample cabinet door first person perspective video by Barker Modern Cabinets,,35,first person woodworking
bVUFzXug2yA,demolished a house 🪵! #woodworking #vlog #sony,,17,first person woodworking
88N4YfyTCow,The First 5 Hand Tools Every Beginner Woodworker Should Buy,,10:22,first person woodworking
qtxYpmYMBbY,#Reddit #diy #fyp #woodworking #ask,,56,first person woodworking
ozv9Z0YN4Ik,#reddit #diy #woodworking #fyp #satisfying,,1:00,first person woodworking
c48IspKX2Hc,First Person Trick Shots are Just Different… 🤔 #shorts,,9,first person woodworking
4KOR7srK5XE,1 vs 2#viralshort #bgmi #woodworking,,26,first person woodworking
PBX9npErZnY,Impossible First Person Bottle Flips!! 🔥 #shorts,,8,first person woodworking
Y_UpH_xUvM4,#gaming #woodworking,,18,first person woodworking
50MEVTe5zAE,OLD Player With USP 💀🥶😭#foryou  #trendingshorts#popular #woodworking#woodworkingart wooddesigner#ff,,10,first person woodworking
lbjmta-fWho,1v2 one tap 😈 #woodworking #woodworkingart #1v2 #raistar #trendingshorts #trending,,15,first person woodworking
7Z0HbKdXIhk,#birdtrend,,21,first person woodworking
m8K-jfPP6GU,🧱 Building with Mini Bricks 2 Wall |  DIY Construction,,20,first person woodworking
3vaMLPHgM7c,This was like the first 18 months of our experience #cnc #woodworking #laser #maker #usa,,17,first person woodworking
