id,title,description,duration_string,search_keyword
jUkDTpQ_4MU,POV Crispy Fried Bread Flow | Dough to Golden Perfection | Real-Time Street Food Craft,,1:04:12,POV cooking techniques
r9DqZRM7FQU,Busy Friday 🤯| Simple but Great | POV Cooking,,1:12:28,POV cooking techniques
fqqwFWqxUr4,POV: How to Make an Omelette Like a Chef,,6:56,POV cooking techniques
KUzYFMgWs4w,POV: 15min SUSHI RUSH!,,15:14,POV cooking techniques
Nm0CMFrqXgY,POV Cooking: SINGLE Grill Handles the ENTIRE Restaurant's Steak Orders,,43:56,POV cooking techniques
7S9q1kAVmc0,POV: Line Chef in a Top London Restaurant,,35:51,POV cooking techniques
N8w8LKwOeO0,POV: Chef Grilling at Top London Restaurant,,32:48,POV cooking techniques
Z7XIY_92Mak,POV: Chef Plating in a Top London Restaurant,,33:32,POV cooking techniques
u9nry4Psey4,$53 High-end Fried Rice - Wok Skills of Master Chef in Hong Kong,,4:30,POV cooking techniques
c1HE6bgmbsM,"No Stoves, No Ovens, All Live Fire: A Day With the Sous Chef at Osito | On The Line | Bon Appétit",,21:50,POV cooking techniques
ZdO30snWRdY,Three Basic Cuts: Part 2 (Still Beginner?) #diy #cook #knifeskills #chef #pov #howto #valentinesday,,54,POV cooking techniques
MvSYttvUxA0,POV: Cooking Restaurant Quality Mashed Potatoes (How to Make Them at Home),,6:30,POV cooking techniques
UbeEGWmud-4,"Amazing Wok Skills! Cooking with Extreme Powerful Fire - Wok Skills in Taiwan /台式大火快炒! 海鮮熱炒, 大民生平價海鮮",,15:41,POV cooking techniques
W9890Bcq6kE,The POV Guide to a PERFECT Lunch | Lunch Chaos😥POV Cooking 🔪🍔🧀🍳,,54:25,POV cooking techniques
hyj1UlkudzQ,The Chef’s POV: Quick and Elegant Cooking Techniques,,1:33:33,POV cooking techniques
Ipe9xJCfuTM,POV: Head Chef at a Top London Restaurant,,29:10,POV cooking techniques
zhI7bQyTmHw,Learn To Cook In Less Than 1 Hour,,59:59,POV cooking techniques
bWPmloTG_uM,POV: Making Gourmet Burgers in a Restaurant Kitchen 🍔 | Insider Cooking Tips | Behind the Scenes,,28:07,POV cooking techniques
wZdQ3j72Ucg,How Italian Chefs Cook Your Food: From Order to Plate,,56:24,POV cooking techniques
XYm9ywkR6Fg,POV: Bartender Making Cocktails at a Top London Restaurant,,29:04,POV cooking techniques
v5Nzabq0wbQ,Pov shot of the paneer cutting ✨🎥 #bts #food #cinematic #pov #diy #commercial #camera #filmmaking,,14,POV cooking techniques
6po7r8-AXqo,POV How to Cut: Kitchen Knife (Some Beginner tips to start!) #pov #tips #diy #howto,,54,POV cooking techniques
AMl5mKJqSiA,How to make omelette #asmr #omelette #food,,24,POV cooking techniques
0FBoiUK_530,POV Sautéing: The Most Important Cooking Technique (New Chef Training),,1:14:15,POV cooking techniques
-hHFILBCVeE,taco bell 5 layer burrito,,35,POV cooking techniques
UTgoSLXw0VQ,POV: Chef Running a Chicken Restaurant,,23:13,POV cooking techniques
GNqeVqfChX4,McDonalds Training: Quality #shorts,,13,POV cooking techniques
bZdeCH_88zg,Breakfast Fry Up | Over The Fire Cooking by Derek Wolf,,59,POV cooking techniques
MpW_RAIbo_Q,chef tossing skills #shots #chefworks #viralvideo #cheflife,,15,POV cooking techniques
1csQopQd17o,POV Cooking: The Secret to PERFECT Grilling Teamwork Revealed,,50:14,POV cooking techniques
r5WNjoeJNzg,POV: Cooking Restaurant Quality Fish (How To Make it at Home),,9:04,POV cooking techniques
9D9h53Q1AEA,POV: Bartender at a Top London Restaurant,,28:03,POV cooking techniques
yrl_XPDys5c,POV: You’re Cooking for 9 Kids at Once (Breakfast Recipe),,59,POV cooking techniques
1G-9Pibx5JI,POV: Bartender at One Of LA's Busiest Bars | Bon Appétit,,17:40,POV cooking techniques
G-Fg7l7G1zw,Basic Knife Skills,,6:34,POV cooking techniques
lk6WazJ3P9w,I Learned to Make Ratatouille (Like the film),,57,POV cooking techniques
N2s_ZlhKLeE,"McDonald's POV: Fried Products (Nuggets, McChicken, Crispy Chicken, Fish)",,6:08,POV cooking techniques
gimNce_NsoM,"Chefs don’t make mistakes, they create new dishes @theriginstitute  #hotelmanagement #chef",,15,POV cooking techniques
1bn8cQ-9-KM,POV- A solo barista working through a lunch rush...,,28:57,POV cooking techniques
W3WOvrb5WKc,Our camera is better and cheaper😮‍💨📸 #pov #camera #fyp #povcamera #football #shorts,,11,POV cooking techniques
4x8XQAPC4Vk,Today I'ave been mostly washing dishes! POV kitchen porter action 👌😂👍,,28:00,POV cooking techniques
5N0vf-f4FDA,POV: Cooking Breakfast in Rush Hour 🍳 | #pov #cooking #breakfast #shorts,,56,POV cooking techniques
p28wMbunulQ,How To Chop Every Vegetable | Method Mastery | Epicurious,,42:43,POV cooking techniques
RKWLu6UHryQ,McDonald's POV: Lunch | Solo Food Assembly,,22:52,POV cooking techniques
2e2iANAmRE4,How to Flip Food in a Pan Like a PRO | Chef Skills,,40,POV cooking techniques
RrTISP_eJ68,POV: The Server Computer During Easter Sunday Brunch,,59,POV cooking techniques
OhIY76s2YZI,"Japanese Food - FISH CUTTING SKILLS Salmon, Mackerel, Squid Sushi Kyoto Seafood Japan",,38:27,POV cooking techniques
bhaq9xyy3vo,How to climb a tree saddle hunting #shorts #saddlehunting #pov #bowhunter,,45,POV cooking techniques
z1XshOQJmrw,How To Wrap A Perfect Burrito #shorts,,29,POV cooking techniques
4IhuEGSogNQ,POV: ART TEACHER’S CORRECTING YOUR ART #shorts #drawing #pov,,10,POV cooking techniques
PGu2-QOfLBA,ADHD Paralysis Explained #shorts #adhd,,31,POV cooking techniques
krxgxKHMxUk,Fastest whopper #whopper hopper ever made in #burgerking (8 seconds),,24,POV cooking techniques
oISJfjlLDig,Two Burgers and a Temping Trick #chef #pov #chefs #cooking #burgers #tip #diy #howto #recipe,,45,POV cooking techniques
GFtgzFxgRDo,How TO record POV Videos #phonestrap #pov #iphonevideograpy #iphonephotography,,15,POV cooking techniques
jgvuKGdBis0,"POV: One Man, One Grill – Making Every Burger Count [ SOLO COOKING ]",,37:33,POV cooking techniques
QlwNLIJJEzg,POV Oil Change with your Dad #shorts,,52,POV cooking techniques
qU4xddDQLHo,Knife Skills Progression w/ @NickDiGiovanni & @Meals_by_cug,,20,POV cooking techniques
PXTEi8KWBys,#pov The nerd joins the cheerleading team… #shorts #youtubeshorts,,24,POV cooking techniques
SrPo4RE98pg,POV: You Trick EVERY Hider In Ink Game… #roblox #squidgame #inkgame #viral #shorts #recommended,,11,POV cooking techniques
jzqMrOQXZVA,POV Chefs Cooking 500+ Meals #food #chef #cooking #foodie #kitchen #video,,49,POV cooking techniques
vSutY96FvEc,POV GONE WRONG 💀😭 COLLAB with@thejessicakaylee,,17,POV cooking techniques
TcKHCeojJZw,Two Tips for the Kitchen #pov #chef #tips #diy #howto #kitchen #cooking #protip #bowls #secret #food,,36,POV cooking techniques
ENnFZveqp08,POV: You Fall For A FAKE CODE In Dress To Impress #roblox #dti #dresstoimpress,,13,POV cooking techniques
HILNWybDS34,Shawarma! The Right Way! @shelbyscanada.,,54,POV cooking techniques
kQga0duC9z8,POV: Fulfilling orders in rush🍳 | #pov #cooking #breakfast #shorts,,52,POV cooking techniques
3QNu1qAS3fg,POV Handmade Noodle Craft | Real-Time Dough Pressing & Folding | Morning Market Demo,,49:43,POV cooking techniques
fJbNrVgWi68,POV: Egg Flips 🍳 | #pov #cooking #breakfast #shorts,,50,POV cooking techniques
zThPT9KnoQs,Fastest Chinese food Noodles chef in the world,,3:50,POV cooking techniques
UC9fNuOIO54,My dough Stretch technique !#PizzaPOV #NeapolitanPizza#PizzaMakingok #cool #pizzeria #art #asmr #pov,,1:00,POV cooking techniques
Kd6Vjykcvww,My secret weapon for ace-ing your next job interview!,,1:01,POV cooking techniques
6FZwdr9elLA,How to Cook Broccoli Correctly #shorts,,33,POV cooking techniques
xDzFnhZBhqc,POV: Flipping Eggs for Breakfast 🍳 | #pov #cooking #breakfast #shorts,,56,POV cooking techniques
Y4ufUshGKlk,How to improve your composition  | POV London Street Photography | Fujifilm XF 35mm 1.4 R,,20,POV cooking techniques
LUt2PiO0M1s,"POV Roujiamo Build | Chopping, Mixing & Street Flow | Real-Time Xi’an Snack Craft",,1:24:36,POV cooking techniques
zCONRCA5-J4,Who else has a RBF?? #tiktok #pov #middleschool #meangirls #popular #highschoolmemories #makeup #rbf,,24,POV cooking techniques
UoTVphHtqRQ,"POV: Plating Like a Pro – Clean, Precise, Flawless #pov #ChefLife #POVChef #Plating #FoodArt",,20,POV cooking techniques
HYJY6de8jdQ,POV videos with your phone! #shorts,,10,POV cooking techniques
zjcvFvGX460,POV: Master Sommelier Tips 🍷 #wine #sommelier #viral #tips #foodie #winetasting #winelovers,,14,POV cooking techniques
hYi9cpgn9M0,How to Gut Rainbow Trout #fishing #oregon #trout #hunting #rainbowtrout #pnw,,39,POV cooking techniques
T788Y9dFtaw,5th graders… #storytime #shorts,,44,POV cooking techniques
GAm95yViTgA,Pov the kid who takes PE class way too seriously #greenscreen #nostalgia #school #pov #fypシ,,36,POV cooking techniques
ap8CPtCLWPo,POV: You vlogged your day using the DJI Osmo Pocket 3 🤳,,16,POV cooking techniques
pC6eSnd975c,POV : You tried all Nail Growth tips BUT nothing work 🥲 ||,,32,POV cooking techniques
tK1gtEQu-O8,Easy POV shots with your iPhone with this accessory 🔥,,22,POV cooking techniques
69u5PenT1z4,HOW TO FAKE BEING SICK #shorts #lifehacks,,19,POV cooking techniques
w8GkkXXnQwk,No wrinkles for this girl 🤪#pov #middleschool #sephora #sephorakids #grwm #skincare #grwmmakeup,,1:01,POV cooking techniques
y04mXCEwQ0c,POV Handmade Noodle Craft | Real-Time Dough Pressing & Folding | Morning Market Demo,,49:17,POV cooking techniques
neSTSHSYSHk,POV: When they ask how do you do things with long nails? #Shorts,,15,POV cooking techniques
21PQERK0vAY,Rolling a Supercharged Joint ⚡,,28,POV cooking techniques
eQ1V_ES-Hps,POV: Cooking breakfast 🍳 | #pov #cooking #breakfast #shorts,,56,POV cooking techniques
AbvUzIEW6lw,POV: You Bring Taco Bell To An Italian Sunday Dinner,,23,POV cooking techniques
vPdMRsUTiCI,"This is how I stretch pizza,my special technique!  #pov #asmr #pizza #howtomakepizza #chef #cheflife",,2:04,POV cooking techniques
W0ym6UWM9YI,Barista tips subscribe for more 👇🏻#viral #shortvideos #pov #shorts #short #shortsfeed #shortvideo,,14,POV cooking techniques
QSY_hvj-2q4,pov: You got Infinite Eggs with Seal Method in Grow a Garden... #roblox  #growagarden,,15,POV cooking techniques
IHe-HQ9xp8k,Fried Rice Without What?!,,58,POV cooking techniques
WJfhTGreRCQ,Learn how to hold  and use chopsticks 101,,15,POV cooking techniques
2iUOYXQkATo,"POV: Get on Base, Win an ARIA Sliding Mitt of YOUR CHOICE! #shorts",,31,POV cooking techniques
QGHW1t_upeo,40 BURRITOS... 1 COOK | KITCHEN | Ultimate POV Meal Prep Guide |,,1:39:46,POV cooking techniques
aFN6lsMYISU,POV Sweet Potato Liangpi | Sheet Pulling & Prep Flow | Real-Time Street Snack Craft,,1:16:55,POV cooking techniques
smIOeJRexWI,Let’s make a Steak Sandwich….#Ramsay style ! #recipe,,49,POV cooking techniques
7t9_uw9yJmU,WR has to catch it BUT the QB has to make a better throw. 🤔 #shorts,,9,POV cooking techniques
kwjv9Ho3CQ0,pov: videos BEFORE editing.. on Dress to Impress #dresstoimpress #roblox #dti,,6,POV cooking techniques
9bqSC2J-jhs,Pov cooking chef. Watch me working in supermarket. Fish salmon with vegetables.,,18:34,POV cooking techniques
lVWWkYEwQXY,Satisfying Espresso Workflow ASMR,,34,POV cooking techniques
aopS3q6f1GY,Cooking Tips For Kitchen Beginners | Epicurious 101,,8:11,POV cooking techniques
dBrpcIuuLDU,POV: a crazy Cosmo finds you COLLAB WITH @Yukiyumyum444 ​⁠#dandysworld #funny #satire #roblox #fyp,,29,POV cooking techniques
GPNyhgpSMy8,#hairstylist #storytime #greenhair #haircare #pov #greenhaircolor #haircareprofessionals #funny,,59,POV cooking techniques
FNxiF2_Hb38,【Must See!! Sushi Chef's Technique】Squid Nigiri #shorts #sushi #chefhiro #japan,,23,POV cooking techniques
dgkPxwcFFIw,#pov#Tips,,56,POV cooking techniques
1hgVBWlqsao,Easy Mac & Cheese - No Roux - How to POV Cooking Technique,,11:59,POV cooking techniques
-p5OrJbZkZ0,How to Carry a Heavy Food Tray. Waiter training video! Restaurant Staff Training,,30,POV cooking techniques
p1OV3QG9IoU,POV: IPhones on Netflix Shows #shorts,,12,POV cooking techniques
gCfeZ65D9NY,POV: Asian Mum helps you with your homework,,17,POV cooking techniques
Le1vPATJ5_c,#funny #cooking #shorts #pov #fyp,,46,POV cooking techniques
FtFzEVbass4,Francis has a new study method #pov #funny #comedy #skit #shorts #fyp,,31,POV cooking techniques
AcL1OlU-Smk,Jersey Mikes Problems‼️ #shorts,,35,POV cooking techniques
-COV330RXko,POV: You play Grow a Garden (Roblox),,17,POV cooking techniques
X0SZJ0qWKno,real POV of a Ballerina 🤩 | #ballet #shorts,,11,POV cooking techniques
KhYcKKqXUr0,adulting 101 #pov #travel #tips,,9,POV cooking techniques
03FOqOff_pc,POV V60 Coffee (James Hoffmann Technique) | First Person Cooking,,2:18,POV cooking techniques
C7sGY-nXt_w,POV: Your Toca Boca House is RESETTING‼️,,9,POV cooking techniques
hlXRYB6rhxo,how we make za Traditional Shicken Shawarma,,15,POV cooking techniques
JLIPO6Zmfo8,Bacon wrapped Plum starter | Fine Dining POV cooking #shorts,,55,POV cooking techniques
9FJgDerj6ag,#pov #cooking #restaurant,,47,POV cooking techniques
qEu_W4EJmEU,POV: You always wants long nails at the Nail Salon 💅🏼 #shorts,,11,POV cooking techniques
3sLqPikLR_Q,How to crack a rib in indoor karting...,,12,POV cooking techniques
rCziHmDnFrY,Insta360 GO Ultra – 14 FUN POV Ideas to Unlock Your Creativity,,1:58,POV cooking techniques
5GW5WPzuSPQ,DON'T take this phrase Literally in Japanese #shorts,,10,POV cooking techniques
eFG5OWEVEBk,Top 5 Basketball Tryouts Tips! 😳 (Make the TEAM),,25,POV cooking techniques
UMibmqrLIjE,Why Using Q-Tips Feels So Good 🥴 (not good),,29,POV cooking techniques
pSXUVtY4tvw,POV the rich girl judges you for having a hydro flask instead of a Stanley cup,,18,POV cooking techniques
p0yh4cvD8E8,POV: Cooking Restaurant Quality Chicken Wings & Sauce (How to Make Them at Home),,9:48,POV cooking techniques
R6fMzo3v98g,#pov#fyp#foryou#shorts,,41,POV cooking techniques
mk6GBUFgVkY,POV: You finally master Nel Rin..💀 #bluelock #bluelockrivals #roblox,,26,POV cooking techniques
uS8R3vgmJ7Q,POV: You went through the KFC Hatch Programme❤️🐔,,23,POV cooking techniques
wtL0OMXIOdM,First time in an American kitchen#pov,,57,POV cooking techniques
dSL5SscFyhk,"If you cut & prep your veggies, you'll eat more! #pov #nutrition #vegetables #mealprep #easy #tips",,46,POV cooking techniques
Ab62Yg5B3Ag,#pov : your parents are arguing so you leave but your forgetting someone… #parents #siblings,,12,POV cooking techniques
0VZNvPw1hKE,Breakfast On the Blackstone Griddle | Bacon Eggs and Hash Browns,,55,POV cooking techniques
GmxuSZq8O9E,#pov#fyp#foryou#shorts,,49,POV cooking techniques
J6KXeqNMFAA,fast food POV: Cooking amazing SPECIAL big pizza very fast in restaurant,,3:29,POV cooking techniques
H5yAzD6IRwE,The different types of people at family reunions #pov #relatable #comedy #skit,,46,POV cooking techniques
_7kruNEYMsk,#pov#fyp#foryou#shorts,,29,POV cooking techniques
9WR1CX1B8SE,pov: you try to make friends at school #school,,32,POV cooking techniques
0NwwmBlBrjQ,My Jimmy Job Pt. 4 #jimmyjohns #sandwich #food #foodie #pov #irl #work #howto #sandwichrecipe #asmr,Intro ...,52,POV cooking techniques
FyofQc2cl4I,How Legendary NY Steakhouse Peter Luger Makes the Perfect Steak — Plateworthy with Nyesha Arrington,,9:58,POV cooking techniques
pLD8BlRHzXU,POV : toxic vs healthy relationship when seeing there partner #acting #shortsvideo  #relationship,,11,POV cooking techniques
lVw8_0hW78U,Hardest movement to MASTER in COD Mobile...,,20,POV cooking techniques
2uzdOWANrrQ,POV: The different stages of staying home alone #comedy #relatable #pov,,32,POV cooking techniques
wiWU5WJbFE8,POV: Elder strawberry in stock😳,,16,POV cooking techniques
D73WmP_j5Gk,s1mple Smoke Kitchen Window #csgo #s1mple #cs #smoke #tips #pov #goat#clutch,,23,POV cooking techniques
7hXZW_20dRA,#fyp #foryou #pov #shorts,,31,POV cooking techniques
WiCjbS0DVpg,#pov #foodie,,48,POV cooking techniques
BRPRnzgWLX8,Wild spruce tip paste 🌲 #pov #food #original,,15,POV cooking techniques
D1C4jPOAJfU,#tips #pov #idejualan #risolmayo #short #shorts #shortvideo #shortsvideo #shortsviral #fyp,,20,POV cooking techniques
WSuIN7-yLv8,POV: Rajma Chawal Technique That Went Viral 🍛🔥🇮🇳 #shorts #ai #rajmachawal #veo3 #viral,,9,POV cooking techniques
2H8wBpeEn54,POV YOU WALK INTO A BOXING GYM,,21,POV cooking techniques
PRxsRyGDi7E,#Pov:🇮🇳nsR✅@Juggad😅#simple#tips#tricks#cleaning#technique#utensils#copper#viralvideo#trending#shorts,,1:01,POV cooking techniques
6igxSpt2fRQ,POV: A WHITE KID WALKS INTO A YN SCHOOL☠️.. #roblox #fightinaschool #verowtv,,32,POV cooking techniques
MpTkziT0Vjw,#pov #cooking #howtomakewhitesaucepasta #italianrecipes #howtomakespaghetti #italianfood,,2:00,POV cooking techniques
-Z7TIYe01jE,Lvp Flooring tips 🔨 #tips #tipsandtricks #flooring #pov,,15,POV cooking techniques
1LGbLL7TleY,Speed slicing! #subs #fast #pov #work #jerseymikes,,51,POV cooking techniques
K9PiLh28pcw,#pov#Tips,,52,POV cooking techniques
CDCMyd2CZXk,POV: Turning your kitchen   || MissLegarda,,30,POV cooking techniques
ma4llkQUa1Y,some tips to make your partner love you more 🫰🏻 #pov #husband,,11,POV cooking techniques
MZB_9Va4hOU,POV Handmade Noodle Craft | Real-Time Dough Pressing & Folding | Morning Market Demo,,59:30,POV cooking techniques
z15Es7tBd3A,#pov #dothingsyoudontwanttodo #tips #funny #ihavethisthingwithplants,,53,POV cooking techniques
pQAHavuF5EE,P.O.V Let's cook Sinigang na baboyl and make  Buko juice #reels #pov #cooking #algorithm #creators,,1:29,POV cooking techniques
MzTyDzAylLw,POV: Caldo de Pollo = Weight Loss Goal | sustainable fat loss tips,,1:02,POV cooking techniques
ofk-z7c43mA,"POV: Helping Mom in the Kitchen & She Says ""Your Future Wife is Lucky"" | Wholesome Cooking Moment",,10,POV cooking techniques
f4qIHP8x8S8,"POV: ADOPT ME Players After Getting Scammed With The ""Whipser Method""",,7,POV cooking techniques
20IjZlaOxww,Village method of making stew.#viral #youtubeshorts #food #pov #foryou #delicious,,2:05,POV cooking techniques
QxkZUTYArxg,anyone know tips how to make herbs last longer 😂 #fyp #pov #minivlog #selfcare #lowcalorie,,1:52,POV cooking techniques
nugHWIk9_pY,3 KENDAMA TRICKS FOR INTERMEDIATE PLAYERS ⚡️ #kendama #trickshots #pov,,10,POV cooking techniques
r-6K2JtKdyQ,POV: You’re a noob in Ink Games,,15,POV cooking techniques
lA3wNQadx10,Chef Life: Plate Up Presentation #food #cooking #pov #chef #cheflife #foodie #kitchen #tips #howto,,40,POV cooking techniques
ZzLPUoetSHw,How To Make Every Sushi | Method Mastery | Epicurious,,22:31,POV cooking techniques
gSZf7xXYeI4,Southside Rib Tips BBQ Meal  Famous Dave's #food #pov #tasty,,12,POV cooking techniques
ovr-ITjWSbE,😏😻  #longervideos #lizdg#pov#fyp#shoorts,,57,POV cooking techniques
SSC4l2Ur24c,#pov#Tips,,56,POV cooking techniques
b9w3M9IavQ0,#pov#Tips,,37,POV cooking techniques
78chCkCzI2c,POV: you find the best quality press-on nail brand 💅🏼💃 #shorts #pressonnails,,19,POV cooking techniques
KgvQ5GP75lE,POV: You Get A Chainsaw In 99 Nights In The Forest #roblox #99nightsinaforest #99nights,,22,POV cooking techniques
gpjQQpXa5k8,"Pov,Italian pasta cooking",,59,POV cooking techniques
emf1JwOlMfI,POV: 30 Min of Subway Sandwiches,,30:36,POV cooking techniques
C6C4g55Vsbw,POV: Cooking The Best FISH & CHIPS You'll Ever Have (Restaurant Quality),,10:16,POV cooking techniques
pm0fjN7k5_M,Subway POV Making My Favorite Sandwich,,47,POV cooking techniques
z6UQpGQ5AYY,Sugar on My Tongue Trend 😂 #pov #trending #edit #fypシ゚viral,,16,POV cooking techniques
P1eYv-pz9Lc,POV: INSIDE A BUSY ITALIAN RESTAURANT DURING DINNER SERVICE,,47:17,POV cooking techniques
3tOPmO0kVFc,POV CHEF - Life as an Executive Chef #food  #cooking #pov #chef #chefpov #kitchen #atlanta #georgia,,24,POV cooking techniques
nZfPIbLF28o,Professional Plating Preparation Guide | POV Service Tutorial | Expert Tips,,18:39,POV cooking techniques
RuSBTulQ0uI,This is an authentic French Conversation,,10,POV cooking techniques
u6p8XKPgcH0,Pov: You're fighting Todo | Jujutsu Shenanigans,,9,POV cooking techniques
JxZWcu3Om7k,Whos side of the family is better moms or dads #parody #Siblings #sibling #cousins #cousin,,58,POV cooking techniques
kNmtGiGtDIM,POV: How to order the world best sandwich,,2:55,POV cooking techniques
iDRLeqyGt24,First date advice #shorts,,1:00,POV cooking techniques
uZ1cWhz_4HQ,POV : Sick At Home Cooking In My Portable Hotpot Cooker!!,,18,POV cooking techniques
VJGlRxLKMHU,DO THIS! If you get a BAD Haircut✂️❌,,10,POV cooking techniques
UAJ92FEoCS0,POV: You have a rare brainrot in Steal a Brainrot,,17,POV cooking techniques
kyonlq8ixZQ,POV: Solo Fine Dining at a Three Michelin-Starred Restaurant,,2:29,POV cooking techniques
kpfYn3mnpTg,SEEING IF I AM A GOOD KISSER #shorts,,23,POV cooking techniques
ENqVk3nba_Q,#funny #pov #tips #ihavethisthingwithplants #dothingsyoudontwanttodo #acting #capcut,,56,POV cooking techniques
FgIc_D2u_js,Easy Milk steaming Technique 😁😁 #barista #coffee #pov #milksteaming #shorts,,45,POV cooking techniques
ihlnjkA1dM0,POV: ME REMEMBERING TO PUT ON SUNSCREEN☀️#cocoandeve #sunscreen #spf #sunburn #tanning #summer,,8,POV cooking techniques
62pYJbgp7JY,#foryou #froyoupage #viral #story #pov,,55,POV cooking techniques
3DFPa5fy_VI,The different stages of pulling an all nighter #comedy #pov #relatable #skit,,49,POV cooking techniques
nuyp51cE59c,The different types of people on family road trips #pov #comedy #relatable #skit,,45,POV cooking techniques
w6Gb1CPPRos,Me cooking 🤦‍♀️😅 #funny #viralvideo #shorts #pov #problem #cooking,,13,POV cooking techniques
2ibEgyu5HHk,and you never get the hair tie back #shorts #pov #acting,,20,POV cooking techniques
I4ubvSGTWRg,POV: You stay at a hostel l Living alone #hostellife #hosteller #aiimshostel #collegelife #aiims,,19,POV cooking techniques
Dwx_MbYz3Ck,#pov#Tips,,41,POV cooking techniques
YebnAT4qpx4,POV: you’re a redstone god,,8,POV cooking techniques
aIeeNaPeQGA,POV: Chole Bhature Technique That Went Viral 🌶️🔥🇮🇳 #shorts #ai #cholebhature #veo3,,9,POV cooking techniques
e9aey8vcDQk,POV Handmade Noodle Craft | Real-Time Dough Pressing & Folding | Morning Market Demo,,57:13,POV cooking techniques
rHZLz5UxuiI,POV: You were raised by strict parents #parents #trauma #childhood #shorts,,16,POV cooking techniques
DrH9t6XNA7M,What to Do if You Didn’t Study,,27,POV cooking techniques
R9Rkl5JfT_U,fast food POV: 10 Minute of cooking burger in fast food restaurant,,10:02,POV cooking techniques
2kvfcJrdQww,POV: How to Cook Fish Like a Chef,,10:30,POV cooking techniques
Ml5VqtUwHck,POV you can finally do this on short hair 🙏🏼 #hairhacks,,11,POV cooking techniques
ZTvRQ_GL6QA,How to eat spicy food,,46,POV cooking techniques
rHLEpZ8l1y0,Perfect Tilapia with Celeriac Mash 🐟 | Fine Dining pov #shorts,,19,POV cooking techniques
E5jCNC7buOs,Part 8  #pov #foryou #podcast #podcastclips #viralvideo,,59,POV cooking techniques
KRWPVRBIMnc,#pov #fyp #foryou #short #funny,,14,POV cooking techniques
nDiz42AOdiQ,#cooking #pov #chef #food #recipe #funny #motivation,,39,POV cooking techniques
NP4xBt5K3BI,#pov #invisible #amsr #redditstories #diy #maker#rizzapp#novelshort#fyp#relaxing #funny#music,,45,POV cooking techniques
xFbN_Idg40Q,fast food POV: Cooking AMERICAN fast food in busy persian Mcdonald's,,8:08,POV cooking techniques
Kqp9pT1UOXM,POV: Restaurant Quality Risotto at Home,,5:34,POV cooking techniques
vM_HgRssHHA,Number 1 Pepe #jimmyjohns #pov #onthejob #shorts #sandwich #sandwichrecipe #work #irl #shoets,,1:01,POV cooking techniques
cFeGZ-9Yuis,#pov#Tips,,43,POV cooking techniques
piyKGX4SSs8,#pov #tips,,41,POV cooking techniques
hxtfX7bYTdA,#pov#skit #comedy #foryous #fyps #viral #acting #storyime #xyzbca #tools #diy #shorts #youtube,,2:33,POV cooking techniques
ui-Jn3klt5o,How POV Content Is Filmed: Behind the Scenes #pov #povs #neckphoneholder,,27,POV cooking techniques
Z8F0_riCkq8,#storytime #cooking #funny #foryou #pov,,45,POV cooking techniques
ITw45zsOSWM,“I have a method” 🥲 #greenscreen #sephora #retail #pov #customerservice #karen #makeup,,1:00,POV cooking techniques
3LDxAu-WUtY,#funny #bistrohuddy #cheflife #staffingservices #foryou #pov #cooking #storytime #restaurantlife,,54,POV cooking techniques
OmqVi-DWLUA,That one kid who- oh #pov #nostalgia #fypツ #middleschool #greenscreen #school,,57,POV cooking techniques
8E-aH5CIZOQ,#shorts #156#fyp #pov,,59,POV cooking techniques
8o9JPV097uA,POV: The 6 stages of being sick 🤧,,37,POV cooking techniques
Mbh8n3sFvo0,POV - Opening $1900 Last Bottle 1999 Chateau Latour #fypシ゚ #fyp #pov #wow #trending #wine #sommelier,,2:29,POV cooking techniques
zYcQZ1GEALk,fast food POV: Cooking incredible SPECIAL fast foods in extra Busy restaurant,,10:26,POV cooking techniques
QSoneOMEOlM,🍺DIY Fermenter Blow-Off🍺#brewtok #brewerylife #craftbeer #cellarwork #pov,,1:11,POV cooking techniques
ZrOpk-3J9TI,#pov #povs #povstories #actingskills #actingg #acting #dramaticstory #familythings #foryoupage,,54,POV cooking techniques
9AxXW4IgwIQ,#love #bebe #baby #storytime #cooking #pov #cookingfood #funny #foodpreparation #duet,,58,POV cooking techniques
R_r1SacoVKc,That transformation though 😳 | Tomboy | Hot Tomboy | Boyish,,11,POV cooking techniques
b0IuTL3Z-kk,How To Mix Every Cocktail | Method Mastery | Epicurious,,37:00,POV cooking techniques
1yQQlD_oX1E,99 NIGHTS IN THE FOREST SECRET 😱,,14,POV cooking techniques
tfNSt9FV_1Y,POV Sushi 🍣 Soba Noodles Inside Sushi Roll,,38,POV cooking techniques
TpqbPJei4eM,#pov #humor #tips,,58,POV cooking techniques
oSUsGrVD1x8,#humor #storytime #funny #youtube #pov#fy #foryou #experimento #curiosidades #youtuber  #viral,,1:00,POV cooking techniques
qbrpm0pdUVI,#gardening #garden #organic #asmr #pov #watermelon #tomatoes  #follow #tips #tiktok,,13,POV cooking techniques
n2HoDnqQ4pA,When i drive peacefully 😨 #pov #focus #driving #car #shortvideo #asmr #funny #funnyvideo #skills,,20,POV cooking techniques
qeLxCIeZexQ,#funny #viralvideo #comedy #pov #fyp,,58,POV cooking techniques
